title,content,date
삼성 갤럭시 워치4 블랙 40mm 3일 사용 후기,갤럭시 웨어러블 앱에서 갤럭시 워치4가 정상적으로 인식하는 것을 확인할 수 있습니다. 이 앱에서 워치페이... 4. 실사용 관련 제가 기존 타이젠 OS 기반 액티브1을 사용했던 입장에서 말씀드리자면.. 웨어OS로 바뀌었다고는...,3일 전
갤럭시 워치4 사전예약 출시일 할인하네영,갤럭시 워치4 사전예약 출시일 할인하네영 이야기를 해드리니 관심을 갖고 찾아보고 있는 중이었다면 지금... 때문에 갤럭시 워치4 사전예약 알아두시면 됩니다 ▶ 갤럭시 워치4 공식최저가 자동적용! [클릭] 여러가지...,5일 전
갤럭시 z플립3 & 워치4에 대한 쓴소리... 발열... 열받네.,겸사겸사 구입한 갤럭시 z플립3 와 워치4 클래식을 이틀째 사용하면서 장단점을 파악하고 있습니다. 구입한... 또한 갤럭시 워치4에 대한 홍보가 제대로 이루어지지 않았다고 생각한다. 알고 계실지는 모르지만 갤럭시...,어제
갤럭시워치4 블랙 44mm 개봉기 및 첫인상,"기존에는 스테인리스 재질과 클래식한 디자인의 갤럭시워치3, 알루미늄/스테인리스 재질과 심플한 재질의 갤럭시워치 액티브2로 구분되었다면, 이번에는 반대로 심플한 디자인을 기본 갤럭시워치4로 깔고 클래식한...",2021.08.19.
갤럭시 워치4 삼케플 vs 필름or강화유리,사용기종 : 갤럭시 워치4 44mm 질문내용 : (구체적으로): 이번에 첫 스마트워치로 갤럭시 워치4 사전예약한 사람입니다. 워치에 필름이니 삼케플이니 필요없으시다 하시는분들도 계시지만 제가 워치를 바꿀 때가 되면...,2021.08.19.
"삼성 갤럭시 워치4, 클래식 46mm가 땡기는 이유!",기존 갤럭시 워치3가 있음에도 왜 갤럭시 워치4를 또 선택했을까인데요. 디자인만 보면 버튼의 모양과 베젤 안쪽에 눈금 등의 디자인이 조금 바뀐 것과 스트랩 정도로 크게 달라 보이지 않습니다. 그러나 기존 타이젠을...,1시간 전
갤럭시 워치4 초기세팅 완벽 정리! 스트랩 교체 방법부터 각종 측정까지,"티머니 갤럭시워치 앱을 설치해주고 스마트폰과 워치에서 한번씩 실행해주신 다음에 앱에서 시키는 대로 세팅을 해서 바로 사용해주시면 되었고요, 이렇게 하면 갤럭시워치 4의 기본적인 기능들을 대부분 사용할 수가...",4일 전
"내돈내산 삼성 갤럭시 워치4 40mm 블랙 착용샷, 후기",혈압 측정하려면 초기에 혈압계가 필요하다 4. 카톡 답장기능 있음 5. 티머니 결재가능(NFC) 저는 제가... 갤럭시 워치4 착용하고 운동갔다온 후기 갤럭시 워치 배송 D+1 의욕에 불타올라서 운동하러 나왔습니다. 열심히 걷고...,3일 전
"[총정리 2] 갤럭시 버즈2, 갤럭시워치4 클래식, 일반 공개! 달라진 점은?",이번 글에서는 함께 공개된 갤럭시 버즈2 모델과 갤럭시워치4 클래식 일반 모델을 소개해드리려고 합니다. 사실 이 모델들도 언팩 전에 다양한 자료들이 유출되기도 했는데요. 이미 해당 정보들을 보신 분들은...,2021.08.12.
"갤럭시워치4 사전예약, 가격 0원으로?","40mm는 월 할부금이 0원이 되며 44mm는 1,250원 / 42mm는 4,138원 / 46mm는 5,375원이 됩니다. 각각 할부원금이... 바로 갤럭시워치4 사전예약을 할 수 있습니다. - 바로 가기 - 필자는 유독 이번 워치가 끌립니다. 곧 갤럭시...",2021.08.17.
갤럭시워치4 가격 할인 구입 방법! 큐텐 국내배송 삼성공식파트너 갤워치4 중복 쿠폰할인,"제품 : 갤럭시워치4크기 : 40mm컬러 : 핑크골드혜택 : 더셰리프 갤럭시워치 스탠드가격 : 269,000원삼성닷컴 이용 시 해피콘 기프티콘 등 추가 혜택을 제공 받을 수 있지만, 친구가 원하는 건 가격 할인 구입 조건이었다....",2021.08.18.
갤럭시 워치4 공개 무대 Galaxy MWC 2021 6월 29일 주목!,"늘어나고 워치앱 구동 속도가 약 30% 향상되며, 무엇보다 안드로이드 스마트폰 및 태블릿과의 호환성과 안정성이 크게 높아졌다고 합니다. 따라서, 갤럭시 워치4에서는 갤럭시 스마트폰과 동일한 UI 및 UX를 공유하고...",2021.06.27.
"갤럭시워치4 , 티렉스 프로",위가 티렉스 프로 아래가 갤럭시워치4 입니다 gps... 갤럭시워치4가 좀더 정확하네요. 아파트 내라 고층건물 고려해도.. 그러나 배터리는 티렉스가 압승 ㅠㅠ 아직도 고민중입니다 ㅎㅎ,2021.08.19.
갤럭시워치4와 갤럭시워치4 클래식 디자인 기능 차이점 알아보기,공개된 갤럭시워치4와 클래식의 차이점을 알려드리겠습니다. 삼성의 야심찬 기획으로 선보인 스마트워치... 소재 이 부분에서도 차이점이 있습니다 기본 모델은 아머 알루미늄으로 갤럭시 Z 폴드 3과 플립 3과 동일한...,2021.08.12.
"사전 예약 전 현장에서 느낀 갤럭시Z폴드3, 플립3, 워치4 어떤 느낌?","사전 예약 전 현장에서 느낀 갤럭시Z폴드3, 플립3, 워치4 어떤 느낌? 무언가를 구입하기 전 다른 사람들의... 재미있는 것은 갤럭시 워치 4 클래식을 보면 측면 마감도 다른데 영상을 보시면 확실히 아실 수 있습니다....",2021.08.17.
"삼성 갤럭시워치4, 갤럭시투고 사용 후기. 체성분(인바디)가 대박!","삼성 갤럭시워치4, 갤럭시투고 사용 후기. 체성분(인바디)가 대박! 안녕하세요? 태스입니다 삼성... 기존 갤럭시워치와 큰 차이 없습니다! 다만 빠르다고 느껴지지는 않았는데, 그냥 평범한 정도..? 웨어OS 탑재 첫 제품인...",2021.08.19.
갤럭시워치4 그린 삼성 스마트워치 첫 느낌 솔직후기,지인의 갤럭시워치4를 살펴보고 기능을 사용해봤는데요 제품 구성은 충전기와 워치 구성이고 아직 전용 충전기 외 무선충전기 지원이 되지는 않습니다. 갤럭시 스마트폰 최신 사용자들이라면 배터리 공유를 통해 급한...,2021.08.22.
갤럭시 워치3와 갤럭시 액티브2를 하나로?! 갤럭시 워치4 신기능 확인해보자,각자 취향에 맞게 자신에게 맞는 크기와 색상의 갤럭시 워치를 구매하시면 될 거 같습니다. 오늘은 새로 출시된 삼성전자의 갤럭시워치4 장점에 대해서 소개해드렸는데요. 국내에서는 17일부터 23일까지 7일간 사전...,2021.08.16.
"갤럭시 워치4, 갤럭시 워치4 클래식 가격 및 스펙 비교해보니 가성비 좋아 졌네","갤럭시 워치 4 클래식은 기존 갤럭시 워치 3에 해당하는 제품이죠. 이 제품 또한 가성비가 더 좋아졌습니다. 블루투스 42mm가 369,000원, 46mm가 399,000원입니다. 기존 41mm가 429,000원, 45mm가 473,000원이었으니 확실히 워치 4...",2021.08.12.
"갤럭시 워치4 워치4클래식 사이즈, 기능, 스펙 비교","이상 새롭게 출시된 삼성 스마트워치 갤럭시 워치4 및 클래식 모델의 사이즈, 무게, 색상, 가격 등 다른점을 비교해보았습니다. 선택하시는 데 도움이 되셨으면 좋겠네요!^^ https://qoo.tn/AKkmiR/Q108052527 저는 큐텐에서...",2021.08.15.
"갤럭시 워치4 개봉기 및 첫 인상, 20mm 스트랩 호환 후기",갤럭시 워치4는 갤럭시 워치 액티브2의 형태는 유지하면서 많은 변화점을 줬다. 일체감 있으면서 약간 통통하다는 느낌을 줬던 액티브2에 비해 워치4는 별개의 프레임을 통해 슬림해지면서 날카로워진 느낌이 강하다....,2021.08.18.
"삼성 갤럭시 워치4, 클래식 달라진 것은? 사이즈부터 인바디 측정 비교까지!",다만 측면이 유광이 아닌 무광으로 변경되어 호불호가 갈릴 것이라 예상되며 버튼 역시 갤럭시 워치4와 동일하게 사각 형태로 변경되어 갤럭시 워치3 디자인을 선호한다면 망설여질 수도 있는 이번 갤럭시 워치4...,2021.08.21.
갤럭시 워치4 새로운 모습 기대된다!,"모델이 갤럭시 워치4 이름을 부여받게 되며, 원래의 워치 시리즈는 뒤에 클래식이라는 수식어가 하나... 그렇게 될 경우 갤럭시 기기 간의 연동성 또한 여러모로 좋아질 것이라 생각해도 될 것 같네요. 카메라 원격...",2021.08.01.
갤럭시워치4 후면,사종 : 갤럭시워치4 질문내용(구체적으로) : 갤럭시워치4 후면에 구멍이하나있는데 원래있는건가요?,7일 전
갤럭시워치4 더 작고 강해졌다!,"사용자가 스마트워치에 손가락을 갖다 대기만 하는 것으로 골격 근육량, 기초대사량, 체수분 및 체지방률을... 그런데 지금 갤럭시워치4 말고 갤럭시폴더블 시리즈 사전에약 진행시 갤럭시워치4를 공짜로 주는 사은품...",2021.08.14.
갤럭시 워치4 러닝데이터 & 가민포러너 데이터,평소 데일리로 스마트폰과 함께 스마트하게(?) 사용할 스마트워치가 필요하다면 갤럭시워치를 추천합니다. 둘다 좋기는 좋아요 저는 만족. 트레일러닝 기록 갤럭시 워치4 + 음성안내 :: 키로미터당 시간 ( 페이스안내)...,7일 전
갤럭시워치4 실버 40mm 개봉기,갤럭시z플립3와 함께 구매한 갤럭시워치4 ! 아이폰 + 애플워치 조합을 참 잘 쓰던 1인이라 워치를 구매하지 않을 수가 없더라고요 사이즈를 정말 많이 고민했으나 결국 40mm 개봉을 하였습니다! 개봉 직전까지도 이걸...,2일 전
갤럭시워치4 구매 성공 실사용기,갤럭시기어s3 프론티어를 선물받아 사용한지가 5년이 됐다. 결혼 선물로 받고 지금까지 사용했으니 오래썼다.... 갤럭시워치4와 워치4클래식 둘 사이에서 한참 고민했다. 이제는 더 이상 핸드폰 알림이 오지 않는 일반...,5시간 전
"갤럭시 워치4 체지방 심전도 측정, 갤럭시 버즈2 후기! (사전예약 라이브방송 혜택)","- 네이버 스토어- - 11번가 - 사전예약 판매 일정 : 17~23일 라이브 방송 일정 : 17일 09~11시 (11번가) 17일 19시~20:30 (네이버) 갤럭시 워치4, 워치4 클래식, 버즈2 게다가 갤럭시 버즈2를 구매하게 되면 귀여운 버즈 2 케이스...",2021.08.17.
갤럭시워치4 다양한 페이스 적용 방법,일주일 정도 갤럭시워치를 사용하면서 페이스 바꾸기와 줄질에 푹 빠져버렸다. 아직 워치4가 출시된지... *저는 갤럭시워치4로 스마트워치 입문해서 다른 기기 방법은 잘 몰라요.. ㅎㅎ 그리고 이게 제가 아는...,5일 전
갤럭시 워치 3와 4 클래식 시리즈 종류 및 기능 정리와 NFC 삼성페이 언제 허용?,갤럭시 워치 라인업 종류가 이제서야 조금 정리가 되는 것 같다. 왜냐하면 갤럭시 워치 4와 4 클래식이 출시하면서 기존에 보급형 라인업으로 평가받았던 액티브 라인업이 사라졌기 때문이다. 현재 이런 시점에서...,2021.08.22.
갤럭시 워치4 출시일 가격 색상 삼성페이 체험단 사전예약 등 정보 총집합,4. 체험단 2021년 8월 12일 목요일 삼성닷컴에서 진행했던 갤럭시 워치4 체험단은 현재 종료된 상태입니다.... 아이폰 사용자 분들은 애플워치 쓰시고 갤럭시 사용자 분들만 갤럭시 워치4 구입하셔서 모~든 기능 다...,2021.08.22.
삼성전자 갤럭시 버즈2 갤럭시 워치4 라이브방송 스마트워치 무선이어폰으로 사용해보니,갤럭시버즈2세대 #가성비블루투스이어폰 #노이즈캔슬링이어폰 #노이즈캔슬링무선이어폰 #갤럭시무선이어폰 #스마트워치 #갤럭시워치 #갤럭시워치기능 #갤럭시워치충전 #삼성스마트워치 #갤럭시워치4 #갤럭시스마트워치,2021.08.12.
"갤럭시 워치4 44mm 40mm 블랙, 실버 사용기",삼성의 갤럭시 워치가 애플 제품보다 더 이쁘게 나오는 날도 오는군요. 개인적으로는 갤럭시 워치4 가 더... https://youtu.be/pfWewqcDkxU 또한 워치 4 갤러리를 통해서 아래 사진과 같은 귀여운 고양이 사진을 고를 수...,4일 전
"갤럭시 버즈2, 워치4 클래식 후기 및 삼성전자 라이브 방송 예고!","삼성전자의 폴더블폰 2종과 함께 주목받고 있는 갤럭시 버즈2와 워치4 클래식을 조금 빠르게 써보게... 다음은 갤럭시 워치4 클래식으로 42mm, 46mm 두 가지 모델이 출시됩니다. 개인적으로 다이얼이 큰 시계를 선호하는...",2021.08.17.
갤럭시 워치4 lte 가격 할인하네여,갤럭시 워치4 lte 가격 할인하네여 비싸게 사지 말고 모든 혜택과 배송서비스까지 전부 받아가지고... 소식이라 갤럭시 워치4 lte 안내를 해드려요 ▶ 갤럭시 워치4 공식최저가 자동적용! [클릭] 이번 기회를 놓치지...,4일 전
"갤럭시 워치4 그린, 실버 44mm 개봉기 (feat. 사은품 스탠드)",갤럭시 워치4가 출시되자마자 사전예약에 성공해서 어제 수령했다. 참고로 갤워치는 인기가 너무 많아서 새로 출시된 모든 모델(일반 및 클래식)의 사전 판매는 조기 종료되어 버렸다. 사전예약이 열린 날 바로...,5일 전
갤럭시워치4 티머니 설정부터 실사용해보기,스마트폰 플레이스토어로 가서 갤럭시워치4 티머니를 설치를 해줍니다. 스마트폰에 앱을 설치하면 자동으로 워치에 설치가 되더라고요. 단 워치에 설치가 되는 데는 시간이 쪼금 걸렸습니다. 그리고 설치가 돼도...,2021.08.22.
"갤럭시워치4 클래식 기능, 가격 정리!",그럼 지금부터 새롭게 출시한 삼성 갤럭시 워치4 기능과 디자인을 살펴보도록 하겠습니다. Watch... 갤럭시 버즈의 경우에도 갤럭시 워치에서 버즈 상태를 확인할 수 있고요. 설정도 변경이 가능합니다. 삼성...,2021.08.17.
스코코 리얼핏 액정 보호 필름 리뷰 (for 갤럭시 워치4 46mm),"이번에 갤럭시 워치4 클래식 46mm 제품을 사전 판매로 구매하면서 제일 먼저 구입한 액세서리가 액정 보호 필름입니다. 웨어러블 기기로는 갤럭시 워치를 거의 3년 가까이 쓰고 있는데, 이 제품에서는 액정 보호...",3일 전
갤럭시워치 4 사전예약 혜택 사은품 다받기,혈액 산소는 갤럭시워치 3에서 30분마다 한 번 측정되는 것과 비교하여 갤럭시워치 4에서는 밤새 1분에 한 번 측정됩니다. SpO2 수치가 높을수록 특히 수면 무호흡증이 있는 사람들이 사용하기에 정말 좋습니다....,2021.08.17.
사전예약한 갤럭시 워치4가 도착했다,"했는데 워치 전원 켜니까 바로 내 핸드폰을 인식했고, 서로의 기기 화면에 나타나는 숫자를 입력하자 손쉽게 연결됐다. 갤럭시 워치4와 핸드폰을 연결해주는 갤럭시 웨어러블 어플과 건강/운동관련 측정을 위한 삼성헬스...",6일 전
[KT 웨어러블 기기 개통] 갤럭시 워치 4_LTE_44mm 언박싱,비교해 봤자 아무 도움이 되지 않을 것 같지만 갤럭시 핏2 와 갤럭시 워치 4 갤럭시 핏2 구매할 당시에도 워치를 사야하나 엄청 고민했었다. 손목이 얇아서 워치가 너무 커보였다. 작은 시계들만 하다가 큰 워치가 불편할...,5일 전
갤럭시 워치4 대대적 변화 예고…웨어OS 확정,17일(현지시간) IT 매체 샘모바일 보도에 따르면 삼성전자의 갤럭시 워치 4 운영체제로 웨어OS(Wear OS)가 적용된다. 웨어OS는 구글의 안드로이드를 스마트워치에 맞게 개발한 운영체제다. 갤럭시 워치는 타이젠...,2021.05.18.
갤럭시 워치 4 클래식 일주일 사용 후기,"띵동 ♪♪ 사전예약한 갤럭시 워치 4 클래식과 딸내미 갤럭시 워치4가 도착했어 yo~ 택배는 아니고 삼성... 갤럭시 워치가 4가 나올 때까지 한 번도 사용하지 않았는데, 이번 기회에 건강 기능을 위해 구입한 거니 일단...",2일 전
삼성전자 갤럭시워치 4 버즈2 신상 웨어러블 라이브 방송에서 만나요!,이렇게 갤럭시 워치 4와 버즈 2를 함께 살펴봤는데요. 이전 세대의 웨어러블 제품들에 비해 기능과 디자인 면에서 상당수 개선된 모습을 보니 구매 욕구가 불타오르지 않나요? 8월 17일부터 삼성 갤럭시 버즈 2와 워치 4...,2021.08.17.
갤럭시 워치4 혈압 보정 및 측정방법 스마트 무선 혈압계 사용기,"갤럭시 워치4 혈압 보정방법 꽉 메고, 팔꿈치에서 2CM 떨어트리기! 일단 삼성헬스 앱과 삼성헬스 모니터 어플을 설치하시구요, 워치보정하기 클릭을 해주시면 됩니다. 팔과 손에 물기가 없게 하시고 조용하고 편안한...",10시간 전
갤럭시 워치4 클래식 42mm 실버 개봉기 / 갤럭시 워치4 기능,"귤탱의 새로운 스마트워치 갤럭시워치4 개봉기! 삼성 갤럭시 워치4 42mm 클래식 실버 삼성 갤럭시 워치4 42mm클래식 실버 1년전 아이폰에서 갤럭시로 갈아탄 귤탱. 만족하며 잘쓰고 있는데요 이번에 갤럭시 Z 플립3, 갤럭시...",4일 전
"갤럭시워치4 클래식 차이, 스펙, 가격, 스페셜스탠드 받는법 ( 삼성 스마트워치 추천 매력은? )","갤럭시워치4 사전예약시에, 선착순으로 특별한 선물을 제공 하는데요. < 스페셜스탠드 >입니다. < The Serif 갤럭시워치 스탠드 >와 < 그랑데AI 갤럭시워치 스탠드 >를 제공을 합니다. 다만 문제는 삼성전자...",2021.08.22.
갤럭시 워치4 보호필름 붙이는 방법(힐링쉴드 필름),최근 갤럭시 워치4를 구매하면서 액정 보호를 위해 보호필름을 붙혔다. 사실 나는 핸드폰은 몇 년 째 보호필름 없이 사용 중인데 워치의 경우는 활동을 하다보면 여기저기 부딪칠일도 많고 핸드폰처럼 주머니에 넣거나...,2일 전
"[삼성] - 갤럭시 워치4 : 핑크골드, 40mm 언박싱",#갤럭시워치 #갤럭시워치4 #갤럭시워치4언박싱 #갤럭시워치4핑크 #갤럭시워치4핑크40mm #워치4 #갤럭시워치4핑크언박싱 #워치4언박싱 #galaxywatch4 #watch4 #갤럭시워치4사전예약구매 #갤럭시워치4스탠드 #갤럭시워치스탠드...,5일 전
삼성 갤럭시 워치 4 .40mm 사전구매 8월25일 도착 언박싱,빈이에요 :-) 이번 포스팅은 #갤럭시워치4 #갤럭시워치 #갤럭시워치4사전구매 #갤럭시워치3사전예약 #갤럭시워치언박싱 #갤럭시워치40mm #갤럭시워치스탠드 #갤럭시워치serif #갤럭시워치거치대 #갤럭시워치충전기 입니다....,어제
"[스마트 워치] 삼성 갤럭시 워치4 클래식, 갤럭시 워치4 언박싱 후기","이번 삼성 스마트워치는 위에서 언급했듯이 삼성 갤럭시 워치4와 삼성 갤럭시 워치4 클래식 제품으로 나왔으며, 삼성 갤럭시 워치4의 경우 삼성 갤럭시 워치 액티브 계열의 디자인을 계승하는 제품이며, 갤럭시 워치4...",2021.08.21.
"갤럭시워치4, 애플워치SE 비교 - 걷기운동 위주","보여주는 워치4네요. 평균페이스는 워치se 13분 54초/km, 워치4는 4.5km/h를 나타내고 있습니다. 저의 경우에는... 사용하기에 워치se 사용이 아무래도 편합니다. 갤럭시 워치4와 갤럭시 z폴드3를 3일간 대여해 사용해...",3일 전
갤럭시 워치4 클래식 실버 블랙 할인하네영,갤럭시 워치4 클래식 실버 블랙 할인하네영 저도 시간을 내어가지고 마침 이렇게 편리하게 찾아봤는데... 언제든지 갤럭시 워치4 클래식 실버 참고를 해보세요 ▶ 갤럭시 워치4 클래식 공식최저가 자동적용! [클릭] 마음껏...,7일 전
"갤럭시 워치4 사용 후기_체성분, ECG, 수면 측정&시계화면 변경",사전 예약으로 구매했던 갤럭시 워치4가 안와서 엄청 기다렸는데 시판 시작일인 8/27일 바로 전날에 도착을 했네요. 원래 워치는 운동을 많이 하시는 분이나 폰을 잘 안보지만 알람이 필요한 분들께 유용한건데 저는...,어제
갤럭시워치4 사전예약 사은품 자동 전자 혈압기 선택,파스텔 딸기우유빛 영롱♡ 배경화면은 갤럭시 웨어러블 어플에서 갤럭시워치4 배경화면을 변경할 수 있는데 처음에 워치 배경을 다운로드 하는 시간이 좀 걸렸어요 클래식 핑크색상 너무 예뻐요 로즈골드 배경과...,3일 전
"삼성전자, 갤럭시 워치4 및 갤럭시 워치4 클래식을 발표해",및 갤럭시 워치4 클래식을 발표했습니다. 구글 Wear OS 기반의 원 UI 워치를 탑재했으며... - 40mm - 40.4 * 39.3 * 9.8mm에 25.9g - 44mm - 44.4 * 43.3 * 9.8mm에 30.3g - 40mm - Black/Pink Gold/Silver - 44mm...,2021.08.12.
내돈내산 갤럭시워치4 사전예약&1주일 사용 후기,"갤럭시워치3는 베젤이 있어서 편하기는 하겠는데 무겁고 너무 나에게는 커서. 그래서 어찌됐든 갤럭시워치... 내가 처음 주문할 당시에는 갤럭시워치4가 실버 10개, 핑크골드 22개였는데 그 10분 사이에 죄다 매진됨 ㄷㄷ...",2시간 전
"갤럭시워치4 사전예약 이벤트 쿠폰 신청 및 발급, 사용방법 안내","갤럭시워치4 사전예약 이벤트 쿠폰 신청 및 발급, 사용방법 안내 갤럭시워치4 사전예약 구매자를... 4. 인증이 완료되면 프로모션 페이지로 이동한다. 해당 페이지에서 원하는 배너를 클릭하면 된다. 5-1. 3만원...",어제
갤럭시 워치 4 클래식 아주 꾸시야!!,갤워치 4 당분간 요거 꾸미는 재미에 시간가는 줄 모를듯ㅋㅋㅋㅋ #갤럭시워치4 #내돈내산 #스마트워치 #갤럭시워치4클래식 #갤럭시워치사전예약사은품...,3일 전
갤럭시워치4 보호필름 링케 강화유리 40mm 부착 후기,갤럭시워치4 최초체험단으로 주문한 #갤럭시워치4 실버 40mm 언박싱 하자마자 휴대폰과 연결하고 바로 보호필름을 붙였다. 요즘 출시되는 갤럭시 스마트폰이 보호필름이 붙은 채로 출고가 되어서 워치도 그런가 싶었는데...,2021.08.20.
[전자제품리뷰] 갤럭시 워치 4 클래식 리뷰,하지만 폰이 갤럭시라서 애플워치는 못낄것 같다고 판단했고 갤럭시 워치 3을 사려고 했지만 4가 나온다해서 존버를 탔습니다. 나왔습니다..... 드디어 나왔습니다 저는 갤럭시 워치 4 클래식을 사전구매 했습니다...,2일 전
"삼성 갤럭시 워치 4 언박싱 + 기본 설정 / 워치 4, 워치 4 클래식 구경하기~",SAMSUNG Galaxy Watch 4 44mm 언박싱을 시작했다. 올해에만 벌써 세 번째 갤럭시 시리즈 언박싱이다. 갤럭시 S21+ / 갤럭시 핏 2 / 갤럭시 워치 4... 상자를 열면 이렇게 워치 4가 나온다. 윗면 안쪽에 작은 상자가 하나 더 담겨 있다....,2일 전
갤럭시워치4 lte 스트랩 할인하네영,갤럭시워치4 lte 스트랩 할인하네영 부족함 없이 이해하기 쉽게 알려드렸으니 단순하게 비교부터 참고를 하실만한 중요한 정보가 될수 있을거라고 보는데 모두가 좋아할 유용한 정보가 되기 때문에 갤럭시워치4 lte 놓치지...,2021.08.22.
[ZIP3] 갤럭시 워치4(Galaxy watch4),#갤럭시워치4 #워치4 #galaxywatch4 #galaxywatch 일단 디자인부터 깔끔하니 내 스타일. (그러고 보니 모토360 닮은 것 같기도...) 무엇보다 광고가 와... 세상 멋짐. 그동안 꾸준히 까오던 애플을 이번엔 되게 잘 깐 것 같은...,4일 전
갤럭시워치4 언박싱 리뷰,"<구글플레이스토어 어플다운로드> 스마트캐디 어플 다운로드하려다 잘 안되어서 골프존데카에 문의하니 "" 갤럭시워치4는 기존의 워치들과 달리 기기에 구글 플레이가 설치되어있습니다. 블루투스로 워치와...",7일 전
갤럭시워치4 최초 체험단 1차 2차 미션이벤트,#GalaxyWatch4 #GalaxyWatch4Classic #갤럭시워치4 #갤럭시워치4클래식 #워치4 #워치4클래식 #갤럭시워치 #삼성헬스 #갤럭시워치4최초체험단 #체험단 #워치4체험단 #워치4체험 #삼성닷컴 #티머니 #GooglePlay #삼성전자이벤트,3일 전
"갤럭시워치4 사용후기, 마음에 들긴 하는데...",갤럭시워치가 확실한 자리매김 하려면 배터리 용량부터 늘려야 하지 않을까. 갤럭시워치4은 삼성웨이러블앱으로 간단히 조작! 노트10을 쓰고 있어 연결은 어렵지 않게 삼성웨이러블 앱으로 수월하게 했다. 버즈도...,6일 전
갤럭시 워치4와 갤럭시 액티브 2 비교,"갤럭시 워치 액티브 2와 갤럭시 워치4, 두 워치의 다른 점은? 체성분이 되는 거겠죠. 또한 심전도 측정이 되고.. 수면 중 코골이를 파악할 수 있어요. 워치 페이스로 다양한 배경으로 나만의 스마트워치를 꾸밀 수 있어요....",19시간 전
갤럭시 워치 4 언박싱 후기!!,갤럭시 워치 4 언박싱해봅니다 제품 구성은 워치와 충전기로 단촐합니다 기존 워치 시리즈 기능들은 있고... 이번 워치 4 배터리 성능은 어떨지 궁금하네요 아무튼 갤럭시 폴드 3와 워치 4를 사는데 만만찮은 돈이...,6일 전
