title,content,date
삼성의 역대급 워치..?! 갤럭시워치4 44mm 개봉기,"전작인 갤럭시워치 액티브2의 상자는 상자가 길지 않았지만, 이번 갤럭시워치4의 상자는 갤럭시워치3 상자처럼 길쭉한 모습입니다. 상자를 열어보니 위에는 설명서와 충전기가 있었고, 아래에 제품이...",3일 전
삼성 갤럭시4 워치 클래식 42mm 실버 개봉 후기,이건 후기 따로 쓰려고 사진 찍어뒀답니다~ 대망의 갤럭시 워치 4 클래식! 워치 4랑 워치 4 클래식 중에 뭐로... 워치 4를 처음 켜니까 바로 폰의 갤럭시 웨어러블 앱에서 시작하라는 문구가 떴어요. 휴대폰의 갤럭시...,4일 전
갤럭시워치4 실버 40mm 개봉기,워치4 스트랩 거는 부분이 다른 워치들보다 조금 더 좁다고 비교해 놓은 유튜브 영상을 봤음. 그래서 스트랩교체 할 때 엄청 뻑뻑하게 들어감 그래도 엄청 불편한건 아니라서 잘 차고 다니고 있음 갤럭시 워치4 기능 중...,19시간 전
갤럭시 워치4 보호필름 힐링쉴드 블루라이트까지 차단해줌!,갤럭시워치4 보호필름 붙히는 영상 찍어봤어요! 보호필름 붙히는거 진짜못하는데 워치 액정은 작아서 붙히기 수월하더라구요 ㅎㅎ 붙히기 전 후 모습이에요! 보호필름이 엄청 얇고 액정에 사이즈도 딱맞아서 안붙힌...,어제
갤럭시 워치4 최초 체험단 미션 수행 중,이제 남은 것은 미션 4. SNS 인증 1단계 Wear OS Powered by SAMSUNG 즐기기 워치2까지만 해도 화면을 넘길 때... 워치4클래식 #갤럭시워치 #삼성헬스 #갤럭시워치4최초체험단 #체험단 #워치4체험단 #워치4체험 #삼성닷컴...,14시간 전
"삼성 갤럭시 워치4, 워치4 클래식 크기와 색상 추천 가이드!",반응형 얼마 전 진행된 갤럭시 언팩 2021에서 삼성전자는 갤럭시 워치4와 갤럭시 워치4 클래식이라는 두 개의 스마트워치를 공개했습니다. 이전 세대의 제품과는 다르게 구글과의 협업을 통해서 개발된 원 UI 워치가...,2021.08.13.
갤럭시워치4 최초체험단 이벤트 참가 리뷰,#GalaxyWatch4 #GalaxyWatch4Classic #갤럭시워치4 #갤럭시워치4클래식 #워치4 #워치4클래식 #갤럭시워치 #삼성헬스 #갤럭시워치4최초체험단 #체험단 #워치4체험단 #워치4체험 #삼성닷컴 #티머니 #GooglePlay #삼성전자이벤트...,6일 전
갤럭시 워치4 중간 사용기..,#GalaxyWatch4 #GalaxyWatch4Classic #갤럭시워치4 #갤럭시워치4클래식 #워치4 #워치4클래식 #갤럭시워치 #삼성헬스 #갤럭시워치4최초체험단 #체험단 #워치4체험단 #워치4체험 #삼성닷컴 #티머니 #GooglePlay #삼성전자이벤트 갤럭시...,4일 전
갤럭시워치4 최초체험단 미션 수행,#GalaxyWatch4 #GalaxyWatch4Classic #갤럭시워치4 #갤럭시워치4클래식 #워치4 #워치4클래식 #갤럭시워치 #삼성헬스 #갤럭시워치4최초체험단 #체험단 #워치4체험단 #워치4체험 #삼성닷컴 #티머니 #GooglePlay #삼성전자이벤트 이...,2일 전
갤럭시 워치4 클래식 가격 스트랩 할인되네여,갤럭시 워치4 클래식 가격 스트랩 할인되네여 가장 합리적으로 구매하시는 최고의 방법을 알려드리기 위해서... 이번 기회에 빠르게 알아두시면 도움이 될수 있을거라서 갤럭시 워치4 클래식 가격 안내를 해드려요...,2021.08.23.
갤럭시 워치4 사용기입니다.(gtr 사용중),"(참고로 갤럭시에 gtr, 워치4 호환해서 같이 사용했습니다.) 알림 속도, 전화 반응 속도는 gtr이 더 빠르고, 이모티콘이 워치4는 잘 지원되는데 gtr에서는 아쉽게 지원이 안되네요. 저는 gtr에서 이모티콘 지원 안되는게...",2021.08.15.
갤럭시 S8과 갤럭시 워치4는 CMC 연결 안되나요??,"제목에는 간략한 질문내용 표시 사용기종 : 갤럭시S8 / 갤럭시 워치4 질문내용 : (구체적으로): 각 기계 둘다 같은계정으로 로그인했고, 같은 와이파이 접속중입니다. 워치 -> 설정에서 원격연결 활성화했고 S8 -> 유용한기능...",4일 전
갤럭시워치4 좋네요,갤럭시핏2 쓰다가 오 워치 괜찮은데 싶어서 워치4기다려서 12일 성공했습니다 44mm은색 시계가 얇아지고 속도 빠르다고 하는데 전에껄 못써봐서 모르겠네요 디자인은 마음에 듭니다 근데 충전어댑터를 뭐를 써야된는지......,2021.08.17.
갤럭시워치4 클래식 46 42 할인되네요,갤럭시워치4 클래식 46 42 할인되네요 사야할때 많은 도움이 될수 있을거라고 생각을 합니다 인기가 많은 제품이라서 찾는 분들도 많이 계시는데 얼마인지 정도만 파악을 하셔도 괜찮을거 같은데 저도 지금 갤럭시워치4...,2021.08.22.
갤럭시 워치 4 정품스트랩 개봉기,기존에저는 앱등이였는데 짝꿍의 꼬심으로 이번에 플립3를 구매했어요 애플워치 없으면 못사는정도라 당연히 갤럭시워치도 구매를했습니다! 갤럭시워치 4 사전구매혜택으로 3만원 액세서리 쿠폰을 주더라구요...,3일 전
삼성 갤럭시 워치 4 사용기 / 최초 체험단,저는 태그 달고 미션4 선물 받으러 가겠습니다 ^^ #GalaxyWatch4 #GalaxyWatch4Classic #갤럭시워치4 #갤럭시워치4클래식 #워치4 #워치4클래식 #갤럭시워치 #삼성헬스 #갤럭시워치4최초체험단 #체험단 #워치4체험단 #워치4체험...,4일 전
갤럭시 워치4 스트랩 교체를 해보자 :),워치의 필요성을 크게 못느꼈는데 인바디에 혹해서 생각보다 구매도 몰려서 거의 충동구매로 산... 하지만 다음엔 잘하겠지 긍정긍정ㅋㅋ #갤럭시워치4 #갤럭시워치4스트랩 #갤럭시워치4스트랩교체,4일 전
갤럭시 워치4 사전예약 출시일 할인되네여,갤럭시 워치4 사전예약 출시일 할인되네여 이렇게 알려드리니 이번 기회를 날려버리지 마시고 알아두신다면... 궁금하셨다면 갤럭시 워치4 사전예약 알아두기에 딱이에요 ▶ 갤럭시 워치4 공식최저가 자동적용! [클릭] 가장...,2021.08.23.
갤럭시워치4 가격 LTE 할인되네영,갤럭시워치4 가격 LTE 할인되네영 멀리서 찾지 마시고 제대로 정확하게 파악을 해두시는 것이야 말로 가장... 아니라 갤럭시워치4 가격 합리적인 곳이랍니다 ▶ 갤럭시워치4 가격 공식최저가 자동적용! [클릭] 많은 분들이...,2021.08.16.
갤럭시 워치4 가격 스트랩 할인되네영,갤럭시 워치4 가격 스트랩 할인되네영 많은 분들이 궁금해 하는 가격 정보를 쉽고 간단하게 참고하실수... 있을만큼 갤럭시 워치4 가격 저렴한 곳이에요 ▶ 갤럭시 워치4 공식최저가 자동적용! [클릭] 누구나 인정하는...,7일 전
갤럭시워치4 클래식 실버 LTE 할인하네용,갤럭시워치4 클래식 실버 LTE 할인하네용 한두푼 하는 제품이 아니기 때문에 지금 미리 알아두시고 저렴할때... 해드리니 갤럭시워치4 클래식 실버 알아만 두셔도 좋습니다 ▶ 갤럭시워치4 클래식 실버 공식최저가 자동적용!...,2021.08.16.
갤럭시 워치 4 lte cmc 기능,제목에는 간략한 질문내용 표시 사용기종 : s20+ 질문내용 : (구체적으로): 갤럭시 워치4 lte와 블루투스가 가격 차이가 적어 일단 lte를 사서 나중에 개통을 하려고 하는데 cmc기능때문에 고민하다 커뮤니티 글에 워치4부...,2021.08.18.
갤럭시워치4 사전예약 할인하네용,갤럭시워치4 사전예약 할인하네용 많은 분들이 기다려온 특가 소식을 지금 알려드리려고 이렇게 간단히 정리를 했습니다 ▶ 갤럭시워치4 사전예약 공식최저가 자동적용! [클릭] 궁금해 하시는 분들도 많고 이번에 새로...,2021.08.10.
갤럭시워치4 출시일 할인하네용,갤럭시워치4 출시일 할인하네용 많은 분들이 기다려온 특가 소식을 지금 알려드리려고 이렇게 간단히 정리를 했습니다 ▶ 갤럭시워치4 출시일 공식최저가 자동적용! [클릭] 궁금해 하시는 분들도 많고 이번에 새로 나온...,2021.08.10.
